{
  "type": "object",
  "properties": {
    "applicationLaw": {
      "type": "string"
    },
    "jurisdiction": {
      "type": "string"
    },
    "compensationOfTheOffer": {
      "type": "string"
    },
    "expressionOfTheOffer": {
      "type": "string"
    },
    "party2": {
      "$ref": "http://www.w3.org/2000/01/rdf-schema#Resource"
    },
    "party1": {
      "$ref": "http://www.w3.org/2000/01/rdf-schema#Resource"
    },
    "contractedItem": {
      "$ref": "https://vc-context.elia.be/2022/v1/Device"
    }
  },
  "$id": "https://vc-context.elia.be/2022/v1/Contract",
  "$schema": "https://json-schema.org/draft/2020-12/schema",
  "title": "Contract"
}