[
  {
    "applicationLaw": "https://github.com/energywebfoundation/elia-energyblocks-vcs/tree/master/ontology/v1/applicationLaw",
    "compensationOfTheOffer": "https://github.com/energywebfoundation/elia-energyblocks-vcs/tree/master/ontology/v1/compensationOfTheOffer",
    "contractedItem": "https://github.com/energywebfoundation/elia-energyblocks-vcs/tree/master/ontology/v1/contractedItem",
    "expressionOfTheOffer": "https://github.com/energywebfoundation/elia-energyblocks-vcs/tree/master/ontology/v1/expressionOfTheOffer",
    "jurisdiction": "https://github.com/energywebfoundation/elia-energyblocks-vcs/tree/master/ontology/v1/jurisdiction",
    "party1": {
      "@id": "https://github.com/energywebfoundation/elia-energyblocks-vcs/tree/master/ontology/v1/party1",
      "@context": {
        "address": "https://schema.org/address",
        "brand": "https://schema.org/brand",
        "iso6523Code": "https://schema.org/iso6523Code"
      }
    },
    "party2": {
      "@id": "https://github.com/energywebfoundation/elia-energyblocks-vcs/tree/master/ontology/v1/party2",
      "@context": {
        "address": "https://schema.org/address",
        "familyName": "https://schema.org/familyName",
        "givenName": "https://schema.org/givenName"
      }
    }
  }
]
